Tên khách hàng; Tên sách; Giá; Số lượng; Ngày mua
Hoàng Thái Hậu; Đứa Trẻ Hư (Tái Bản); 150500; 1; 28-3-2023
Hoàng Thái Dúi; Cây cam ngọt của tôi; 82080; 1; 30-3-2023
Hoàng Thái Dúi; Ngôi Làng Cổ Mộ; 157000; 1; 30-3-2023
Hoàng Thái Hậu; Cây Cam Ngọt Của Tôi; 82080; 1; 2-4-2023
Hoàng Thái Dơm; Chuyện Con Mèo Dạy Hải Âu Bay(Tái bản); 32800; 1; 2-4-2023
Hoàng Thái Dúi; Gã Hề Ma Quái - Tập 2; 967500; 5; 2-4-2023
Phạm Văn Chính; Đứa Trẻ Hư (Tái Bản); 150500; 1; 03-04-2023
Phạm Văn Chính; Ngôi Làng Cổ Mộ; 314000; 2; 03-04-2023
